ID,UserId,CourseId,Progress,StartDate,Completed,Title,Category,Total_enrollment,Total_Completions,completion_rate,Username,Department,Enrollments,Completions
EN1093,EMP225,COR0643,100,2022-08-07,1,Teach English Now! Foundational Principles,Education,2096,1567,74.76145038167938,Teresa Andrews MD,Senior Software Engineer,29,22
EN1094,EMP198,COR0110,100,2022-08-07,1,Pricing Strategy Optimization Specialization,Marketing,2073,1707,82.34442836468887,Krystal Griffith,Software Engineer,26,19
EN1095,EMP246,COR0584,100,2022-08-07,1,Customer Segmentation and Prospecting,Business Essentials,4858,4817,99.15603128859613,Cindy Bauer,Senior Software Engineer,28,21
EN1096,EMP273,COR0366,98,2022-08-07,0,Career Self-Management Training and Certification Specialization,Business Essentials,3847,2042,53.0803223290876,Beverly Meza,Solution Consultant,21,14
EN1097,EMP047,COR1079,100,2022-08-08,1,Meeting Investors' Goals,Finance,3665,2040,55.66166439290586,Peter Wright,Software Engineer,29,22
EN1098,EMP090,COR1523,100,2022-08-08,1,"Imagery, Automation, and Applications",Environmental Science and Sustainability,1357,755,55.63743551952837,Erica Reilly,Solution Enabler,26,19
EN1099,EMP105,COR1200,30,2022-08-08,0,Immunology: Immune System and Infectious Diseases,Basic Science,2097,1619,77.20553171196947,Heather Chapman,Solution Enabler,3,0
EN1100,EMP205,COR0130,100,2022-08-08,1,Web Design for Everybody: Basics of Web Development & Coding Specialization,Mobile and Web Development,932,513,55.04291845493562,Amy Lynch,Software Engineer,22,15
EN1101,EMP283,COR1917,100,2022-08-08,1,The Digital Marketing Revolution,Marketing,4332,3972,91.68975069252078,Timothy Campbell,Solution Enabler,15,8
EN1102,EMP039,COR0892,42,2022-08-08,0,Liabilities and Equity in Accounting,Business Essentials,276,160,57.971014492753625,Cindy Mason,Senior Software Engineer,28,21
EN1103,EMP069,COR0198,53,2022-08-09,0,Marketing Strategy Specialization,Marketing,875,745,85.14285714285714,Gregory Francis,Solution Consultant,15,8
EN1104,EMP046,COR1362,100,2022-08-09,1,Developing Data Models with LookML,Data Analysis,561,494,88.05704099821747,James Olsen,Solution Enabler,22,15
EN1105,EMP077,COR1293,100,2022-08-09,1,European Business Law: Understanding the Fundamentals,Business Essentials,350,197,56.285714285714285,Max Blair,Solution Enabler,18,11
EN1106,EMP209,COR0567,100,2022-08-09,1,Introduction to Chemistry:  Reactions and Ratios,Chemistry,3851,3060,79.45988055050636,Krista Walker,Senior Software Engineer,21,14
EN1107,EMP289,COR1132,100,2022-08-09,1,Advanced Grammar & Punctuation Project,Learning English,2631,1907,72.48194602812619,Timothy Terry,Solution Consultant,16,9
EN1108,EMP027,COR1891,9,2022-08-09,0,Inferential Statistical Analysis with Python,Data Analysis,3335,3062,91.81409295352324,Megan Brown,Solution Enabler,5,0
EN1109,EMP030,COR1838,21,2022-08-09,0,Principles of fMRI 1,Data Analysis,518,284,54.826254826254825,Jenny Brown,Solution Enabler,5,0
EN1110,EMP009,COR0833,100,2022-08-10,1,How to Manage a Remote Team,Leadership and Management,1956,1881,96.16564417177914,Allison Black,Solution Consultant,28,21
EN1111,EMP124,COR1859,77,2022-08-10,0,Health and Safety of a Home-Based Childcare Center,Education,2027,1366,67.39023186975827,Joshua Robinson,Senior Software Engineer,20,13
EN1112,EMP202,COR1421,100,2022-08-10,1,Applied Machine Learning in Python,Data Analysis,4634,4306,92.921881743634,Aaron Anderson,Solution Consultant,29,22
EN1113,EMP239,COR0332,80,2022-08-10,0,Digital Transformation Using AI/ML with Google Cloud Specialization,Cloud Computing,1834,987,53.81679389312977,Nicole Salinas,Solution Enabler,15,8
EN1114,EMP015,COR1330,52,2022-08-10,0,Healthcare Marketplace Capstone,Finance,821,698,85.01827040194885,Edgar Francis,Solution Consultant,16,9
EN1115,EMP099,COR0512,100,2022-08-10,1,Fundamentals of Finance,Finance,1823,969,53.15414152495887,Susan Davis,Solution Consultant,27,20
EN1116,EMP088,COR0520,100,2022-08-10,1,Object-Oriented Data Structures in C++,Software Development,3433,2213,64.46256918147392,Mrs. Rachel Clark,Software Engineer,22,15
EN1117,EMP052,COR1325,67,2022-08-11,0,Retail Digital Supply Chain,Business Strategy,1800,1536,85.33333333333334,Alexandra Nguyen,Solution Enabler,19,12
EN1118,EMP022,COR1272,100,2022-08-11,1,Business English: Final Project,Learning English,2541,1842,72.49114521841794,James Luna,Solution Consultant,16,9
EN1119,EMP209,COR1810,54,2022-08-11,0,Cost and Economics in Pricing Strategy,Marketing,4374,2637,60.288065843621396,Krista Walker,Senior Software Engineer,21,14
EN1120,EMP079,COR0893,82,2022-08-11,0,Biology Meets Programming: Bioinformatics for Beginners,Health Informatics,2769,2351,84.90429758035391,Roger Montgomery,Solution Enabler,17,10
EN1121,EMP261,COR0504,100,2022-08-11,1,Diversity and inclusion in the workplace,Leadership and Management,3039,2256,74.23494570582429,James Brewer,Software Engineer,29,22
EN1122,EMP225,COR0415,100,2022-08-12,1,Google Project Management: Professional Certificate,Leadership and Management,4614,2510,54.399653229302125,Teresa Andrews MD,Senior Software Engineer,29,22
EN1123,EMP046,COR1659,100,2022-08-12,1,Interfacing with the Raspberry Pi,Electrical Engineering,881,615,69.80703745743473,James Olsen,Solution Enabler,22,15
EN1124,EMP101,COR0363,100,2022-08-12,1,Leverage Data Science for a More Agile Supply Chain Specialization,Data Analysis,4676,4175,89.28571428571429,Carl Reynolds,Solution Consultant,24,17
EN1125,EMP268,COR1102,45,2022-08-12,0,Explore Core Data Concepts in Microsoft Azure,Data Management,183,171,93.44262295081968,Jerry James,Senior Software Engineer,10,3
EN1126,EMP017,COR0025,8,2022-08-13,0,Business and Financial Modeling Specialization,Business Essentials,2996,1875,62.583444592790386,Peter Brown Jr.,Senior Software Engineer,10,3
EN1127,EMP016,COR0684,100,2022-08-13,1,Foundations of Business Intelligence,Data Analysis,180,144,80.0,Michael Miller,Software Engineer,25,18
EN1128,EMP101,COR0111,100,2022-08-13,1,Networking in Google Cloud Specialization,Networking,2615,1782,68.14531548757171,Carl Reynolds,Solution Consultant,24,17
EN1129,EMP206,COR1368,100,2022-08-13,1,Networking in Google Cloud: Hybrid Connectivity and Network Management,Networking,2378,1310,55.08830950378469,Daniel Rodriguez,Software Engineer,26,19
EN1130,EMP256,COR1676,100,2022-08-13,1,A Crash Course in Data Science,Data Analysis,1006,551,54.771371769383705,Pamela Li,Solution Consultant,21,14
EN1131,EMP007,COR0423,100,2022-08-13,1,IBM Data Engineering Professional Certificate,Data Management,641,380,59.2823712948518,Lauren Green,Solution Consultant,28,21
EN1132,EMP232,COR1658,27,2022-08-14,0,Understanding Cancer Metastasis,Basic Science,1355,979,72.25092250922509,Timothy Cole,Solution Enabler,20,13
EN1133,EMP098,COR0943,100,2022-08-14,1,Science Literacy,Basic Science,232,213,91.8103448275862,Jessica Crosby,Senior Software Engineer,25,18
EN1134,EMP076,COR0343,100,2022-08-14,1,Adapting: Career Development Specialization,Leadership and Management,3588,2083,58.0546265328874,Adrian Flowers,Software Engineer,28,21
EN1135,EMP173,COR0646,100,2022-08-14,1,Storytelling and influencing: Communicate with impact,Leadership and Management,734,665,90.59945504087193,Joyce Lane,Software Engineer,18,11
EN1136,EMP074,COR1319,89,2022-08-14,0,Working with Data,Mobile and Web Development,2551,2150,84.28067424539395,Mrs. Julia Williams,Senior Software Engineer,4,0
EN1137,EMP024,COR0723,100,2022-08-14,1,Reducing Gun Violence in America: Evidence for Change,Public Health,2096,1662,79.29389312977099,Justin Jackson,Solution Enabler,28,21
EN1138,EMP298,COR1619,100,2022-08-15,1,Intellectual Property in the Healthcare Industry,Healthcare Management,3282,2293,69.8659354052407,Amy Johnson,Solution Enabler,23,16
EN1139,EMP224,COR0532,90,2022-08-15,0,Positive Psychiatry and Mental Health,Basic Science,1247,878,70.40898155573376,Zachary Schwartz,Software Engineer,18,11
EN1140,EMP205,COR0310,100,2022-08-15,1,Content Strategy for Professionals Specialization,Marketing,2507,2291,91.3841244515357,Amy Lynch,Software Engineer,22,15
EN1141,EMP048,COR0898,100,2022-08-15,1,Introduction to Deep Learning & Neural Networks with Keras,Machine Learning,4230,2408,56.92671394799055,Fernando Martin,Solution Enabler,12,5
EN1142,EMP255,COR0600,100,2022-08-15,1,Financial Acumen for Non-Financial Managers,Business Essentials,3043,2742,90.10844561288202,Alexa Greer,Software Engineer,9,2
EN1143,EMP100,COR0374,100,2022-08-15,1,Learn English: Beginning Grammar Specialization,Learning English,1291,999,77.38187451587916,Bryan Nguyen,Senior Software Engineer,23,16
EN1144,EMP057,COR1608,100,2022-08-15,1,Manufacturing Process with Autodesk Fusion 360,Mechanical Engineering,599,406,67.779632721202,Leslie Davis,Solution Consultant,22,15
EN1145,EMP050,COR1037,58,2022-08-15,0,Medical Terminology III,Basic Science,2414,2003,82.97431648715823,Patricia Ruiz,Solution Consultant,14,7
EN1146,EMP135,COR0705,28,2022-08-16,0,Project Execution: Running the Project,Leadership and Management,2132,1119,52.4859287054409,Scott Baker,Solution Consultant,5,0
EN1147,EMP178,COR1943,27,2022-08-16,0,Leading Teams: Developing as a Leader,Leadership and Management,541,400,73.93715341959334,Kelly Willis,Senior Software Engineer,7,0
EN1148,EMP166,COR0177,100,2022-08-16,1,Futures Thinking Specialization,Business Essentials,342,215,62.86549707602339,Cindy Bullock,Senior Software Engineer,21,14
EN1149,EMP165,COR0204,100,2022-08-16,1,Introduction to Computer Science and Programming Specialization,Software Development,4873,3199,65.64744510568438,Melissa Franco,Software Engineer,10,3
EN1150,EMP150,COR0336,100,2022-08-16,1,Statistical Thermodynamics Specialization,Mechanical Engineering,1559,923,59.20461834509301,David Wright,Software Engineer,13,6
EN1151,EMP188,COR1126,100,2022-08-16,1,Scripting with Python and SQL for Data Engineering,Data Analysis,1686,1525,90.45077105575326,Luke Wells,Senior Software Engineer,11,4
EN1152,EMP194,COR1494,30,2022-08-16,0,"Big Data, Artificial Intelligence, and Ethics",Data Analysis,1207,990,82.0215410107705,Donald Mcguire,Solution Enabler,22,15
EN1153,EMP246,COR0023,75,2022-08-17,0,Finance & Quantitative Modeling for Analysts Specialization,Finance,2598,1332,51.27020785219399,Cindy Bauer,Senior Software Engineer,28,21
EN1154,EMP212,COR1451,1,2022-08-17,0,Understanding and Strengthening Health Systems,Public Health,1433,949,66.22470341939986,Joseph Vance,Solution Enabler,9,2
EN1155,EMP117,COR0494,100,2022-08-18,1,UCI Project Management Professional Certificate,Leadership and Management,748,703,93.98395721925134,Kayla Goodman,Solution Enabler,26,19
EN1156,EMP294,COR0697,69,2022-08-18,0,Business Analytics with Excel: Elementary to Advanced,Business Essentials,3042,2750,90.40105193951348,Sarah Henry,Solution Consultant,24,17
EN1157,EMP112,COR1664,100,2022-08-18,1,Project Initiation and Planning,Leadership and Management,586,383,65.35836177474403,Scott Long,Senior Software Engineer,27,20
EN1158,EMP024,COR1277,100,2022-08-19,1,Gestión del talento humano,Leadership and Management,4939,4935,99.919011945738,Justin Jackson,Solution Enabler,28,21
EN1159,EMP222,COR1302,100,2022-08-19,1,Molecular Evolution (Bioinformatics IV),Health Informatics,2167,1791,82.64882325796032,Jacob Maldonado,Solution Enabler,22,15
EN1160,EMP070,COR0409,100,2022-08-19,1,Communication For Everyone  Specialization,Personal Development,1849,1649,89.1833423472147,Tiffany Edwards,Solution Enabler,30,23
EN1161,EMP010,COR0958,100,2022-08-19,1,Cyber Threat Intelligence,Security,4796,4421,92.18098415346122,Patrick Sanchez,Solution Consultant,27,20
EN1162,EMP256,COR0237,100,2022-08-19,1,Abnormal Psychology Specialization,Psychology,2781,2508,90.18338727076592,Pamela Li,Solution Consultant,21,14
EN1163,EMP099,COR1308,100,2022-08-19,1,Taking Safety and Quality Improvement Work to the Next Level (Patient Safety VII),Patient Care,2531,1765,69.73528249703675,Susan Davis,Solution Consultant,27,20
EN1164,EMP206,COR0125,40,2022-08-19,0,User Experience Research and Design Specialization,Design and Product,4896,3377,68.97467320261438,Daniel Rodriguez,Software Engineer,26,19
EN1165,EMP290,COR1090,38,2022-08-19,0,"Comparing Genes, Proteins, and Genomes (Bioinformatics III)",Health Informatics,2428,2162,89.04448105436573,Marie Brown,Senior Software Engineer,26,19
EN1166,EMP028,COR0208,62,2022-08-20,0,Expressway to Data Science: Essential Math Specialization,Math and Logic,2101,2029,96.57306044740601,Luis Wright,Solution Enabler,16,9
EN1167,EMP067,COR0059,100,2022-08-20,1,Applied Data Science with Python Specialization,Data Analysis,779,413,53.01668806161746,Douglas Wright DDS,Solution Consultant,10,3
EN1168,EMP047,COR1888,100,2022-08-20,1,Guided Imagery,Research,250,151,60.4,Peter Wright,Software Engineer,29,22
EN1169,EMP254,COR0195,79,2022-08-20,0,Healthcare Law Specialization,Healthcare Management,4369,2807,64.24811169604028,Wyatt Graves,Software Engineer,13,6
EN1170,EMP136,COR0665,78,2022-08-20,0,Introduction to Psychology,Psychology,856,629,73.48130841121495,Patrick Andrews,Solution Consultant,29,22
EN1171,EMP036,COR0497,100,2022-08-20,1,Probability & Statistics for Machine Learning & Data Science,Algorithms,4649,2664,57.302645730264565,Daniel Soto,Software Engineer,29,22
EN1172,EMP107,COR1490,23,2022-08-21,0,Successful Presentation,Business Essentials,244,170,69.67213114754098,Jennifer Lewis,Software Engineer,8,1
EN1173,EMP007,COR1241,100,2022-08-21,1,Oracle Database Platform,Software Development,1186,998,84.14839797639124,Lauren Green,Solution Consultant,28,21
EN1174,EMP297,COR1192,100,2022-08-21,1,Cryptocurrency and Blockchain: An Introduction to Digital Currencies,Finance,3550,3548,99.94366197183099,James Smith,Senior Software Engineer,26,19
EN1175,EMP031,COR0935,65,2022-08-21,0,Children's Human Rights - An Interdisciplinary Introduction,Law,4114,3169,77.02965483714146,David Parker,Senior Software Engineer,9,2
EN1176,EMP085,COR0837,61,2022-08-21,0,Supply Chain Principles,Business Essentials,2943,1802,61.23003737682636,Michaela Swanson,Solution Consultant,7,0
EN1177,EMP132,COR0156,100,2022-08-21,1,Databases for Data Scientists Specialization,Data Management,4082,3361,82.33708966193043,David Mcdowell,Software Engineer,22,15
EN1178,EMP138,COR1340,100,2022-08-21,1,Marketing: Customer Needs and Wants,Business Strategy,1409,1287,91.34137686302341,Richard Blake,Senior Software Engineer,27,20
EN1179,EMP136,COR1360,31,2022-08-21,0,Managing an Agile Team,Design and Product,3714,2775,74.7172859450727,Patrick Andrews,Solution Consultant,29,22
EN1180,EMP192,COR0316,100,2022-08-22,1,Object Oriented Java Programming: Data Structures and Beyond Specialization,Software Development,2750,2672,97.16363636363636,Lisa Gordon,Software Engineer,20,13
EN1181,EMP222,COR1806,100,2022-08-22,1,Algorithmic Thinking (Part 2),Software Development,1748,1119,64.01601830663616,Jacob Maldonado,Solution Enabler,22,15
EN1182,EMP018,COR1475,87,2022-08-22,0,Fundamentals of Management,Leadership and Management,579,437,75.47495682210709,Melissa Campbell,Software Engineer,12,5
EN1183,EMP152,COR1096,100,2022-08-22,1,Launch Strategy: 5 Steps to Capstone Experience,Entrepreneurship,3978,2393,60.15585721468074,Barbara Anderson,Solution Enabler,16,9
EN1184,EMP194,COR0838,100,2022-08-22,1,SAP Professional Fundamentals,Leadership and Management,626,353,56.38977635782748,Donald Mcguire,Solution Enabler,22,15
EN1185,EMP060,COR1481,100,2022-08-22,1,Life Cycle Assessment,Public Health,3891,3386,87.0213312773066,Nicole Fitzgerald,Senior Software Engineer,19,12
EN1186,EMP060,COR0593,59,2022-08-22,0,Malware Analysis and Introduction to Assembly Language,Security,1222,1110,90.83469721767594,Nicole Fitzgerald,Senior Software Engineer,19,12
EN1187,EMP251,COR0530,100,2022-08-22,1,Introduction to Dental Medicine,Basic Science,2750,2142,77.89090909090909,Samantha Cohen,Software Engineer,30,23
EN1188,EMP149,COR1754,100,2022-08-22,1,Entrepreneurship II: Preparing for Launch,Entrepreneurship,437,378,86.49885583524028,Julia Barry,Senior Software Engineer,16,9
EN1189,EMP148,COR0648,72,2022-08-23,0,AI For Everyone,Business Strategy,1433,1106,77.18073970690858,Daniel Thompson,Solution Enabler,14,7
EN1190,EMP069,COR0268,100,2022-08-23,1,Fundamentals of Flight mechanics Specialization,Physics and Astronomy,3238,2094,64.66954910438542,Gregory Francis,Solution Consultant,15,8
EN1191,EMP188,COR1010,29,2022-08-24,0,Introduction to Data Analytics for Business,Data Analysis,3240,2101,64.84567901234568,Luke Wells,Senior Software Engineer,11,4
EN1192,EMP126,COR0524,55,2022-08-24,0,Removing Barriers to Change,Leadership and Management,850,791,93.05882352941175,Catherine Moses,Solution Consultant,10,3
EN1193,EMP132,COR1213,100,2022-08-24,1,Storytelling and influencing: Communicate with impact,Leadership and Management,4868,2794,57.39523418241578,David Mcdowell,Software Engineer,22,15
EN1194,EMP071,COR0368,100,2022-08-24,1,Market Research Specialization,Marketing,1374,1130,82.24163027656476,Timothy Martinez,Solution Consultant,30,23
EN1195,EMP256,COR1760,85,2022-08-24,0,Machine Learning Modeling Pipelines in Production,Machine Learning,4401,2526,57.39604635310157,Pamela Li,Solution Consultant,21,14
EN1196,EMP143,COR1846,100,2022-08-24,1,Value-Based Care: Reimbursement Models,Public Health,4705,3122,66.35494155154092,Joseph Moore,Senior Software Engineer,25,18
EN1197,EMP207,COR1918,100,2022-08-25,1,Hypothesis-Driven Development,Design and Product,2689,1727,64.22461881740425,Roger Rivera,Solution Consultant,20,13
EN1198,EMP034,COR0887,100,2022-08-25,1,"Divide and Conquer, Sorting and Searching, and Randomized Algorithms",Algorithms,4907,4018,81.8830242510699,Michael Parsons,Software Engineer,13,6
EN1199,EMP052,COR0633,100,2022-08-25,1,The Science of Stem Cells,Basic Science,4509,2665,59.10401419383455,Alexandra Nguyen,Solution Enabler,19,12
EN1200,EMP263,COR1645,100,2022-08-25,1,Digital Twins,Business Strategy,2311,1476,63.868455214192984,Larry Curtis,Software Engineer,20,13
EN1201,EMP076,COR0126,100,2022-08-26,1,Good with Words: Writing and Editing Specialization,Personal Development,4720,3662,77.58474576271186,Adrian Flowers,Software Engineer,28,21
EN1202,EMP071,COR0634,100,2022-08-26,1,Nutrition and Lifestyle in Pregnancy,Nutrition,658,448,68.08510638297872,Timothy Martinez,Solution Consultant,30,23
EN1203,EMP205,COR1122,100,2022-08-26,1,Hypothesis Testing in Public Health,Public Health,2442,1637,67.03521703521703,Amy Lynch,Software Engineer,22,15
EN1204,EMP160,COR1801,91,2022-08-26,0,Introduction to Programming with MATLAB,Software Development,4877,4184,85.79044494566331,William Parker,Senior Software Engineer,11,4
EN1205,EMP283,COR0979,20,2022-08-26,0,The Cycle: Management of Successful Arts and Cultural Organizations,Music and Art,1792,1751,97.71205357142857,Timothy Campbell,Solution Enabler,15,8
EN1206,EMP182,COR0621,73,2022-08-27,0,Word Forms and Simple Present Tense,Learning English,1571,1494,95.0986632718014,Mark Austin,Solution Enabler,2,0
EN1207,EMP233,COR0709,100,2022-08-27,1,Introduction to Negotiation: A Strategic Playbook for Becoming a Principled and Persuasive Negotiator,Business Essentials,2472,2347,94.94336569579288,Emily Hill,Solution Consultant,29,22
EN1208,EMP262,COR1309,100,2022-08-27,1,Managing Change when Moving to Google Cloud,Cloud Computing,1043,596,57.14285714285714,Craig Duncan,Software Engineer,26,19
EN1209,EMP002,COR0769,100,2022-08-27,1,Essentials in Clinical Simulations Across the Health Professions,Healthcare Management,3498,2046,58.490566037735846,Kimberly Aguilar,Senior Software Engineer,20,13
EN1210,EMP161,COR0753,69,2022-08-27,0,Machine Learning Foundations for Product Managers,Machine Learning,1690,1598,94.55621301775147,Richard Woods,Solution Consultant,16,9
EN1211,EMP251,COR1908,67,2022-08-27,0,Psychosocial and Spiritual Aspects of Palliative Care,Patient Care,1023,825,80.64516129032258,Samantha Cohen,Software Engineer,30,23
EN1212,EMP016,COR1599,100,2022-08-28,1,Database Management Essentials,Software Development,4657,3595,77.1956194975306,Michael Miller,Software Engineer,25,18
EN1213,EMP228,COR1217,28,2022-08-28,0,"Excel/VBA for Creative Problem Solving, Part 1",Algorithms,3382,3306,97.75280898876404,Danielle Horne,Solution Enabler,24,17
EN1214,EMP118,COR1744,100,2022-08-28,1,Getting started with TensorFlow 2,Machine Learning,3350,2493,74.41791044776119,Kelly Yates,Software Engineer,10,3
EN1215,EMP076,COR1374,36,2022-08-28,0,Effective Compliance Programs,Business Essentials,2460,2198,89.34959349593497,Adrian Flowers,Software Engineer,28,21
EN1216,EMP206,COR1905,100,2022-08-28,1,Machine Learning for Accounting with Python,Machine Learning,3221,3147,97.70257683949085,Daniel Rodriguez,Software Engineer,26,19
EN1217,EMP086,COR0896,100,2022-08-29,1,Solar Energy Basics,Environmental Science and Sustainability,3681,2075,56.37055148057593,William Pearson,Software Engineer,24,17
EN1218,EMP250,COR0764,75,2022-08-29,0,Python Data Structures,Software Development,4402,3965,90.0726942298955,Gina Williams,Solution Enabler,22,15
EN1219,EMP256,COR1022,37,2022-08-29,0,Culminating Project in Health Informatics,Health Informatics,1587,964,60.74354127284184,Pamela Li,Solution Consultant,21,14
EN1220,EMP236,COR0187,43,2022-08-29,0,Photography Basics and Beyond: From Smartphone to DSLR Specialization,Music and Art,2555,1578,61.76125244618396,Diane Peterson,Senior Software Engineer,12,5
EN1221,EMP199,COR1316,32,2022-08-29,0,Coaching Practices,Leadership and Management,2613,1865,71.3738997321087,Richard Kim,Software Engineer,30,23
EN1222,EMP163,COR0014,100,2022-08-29,1,Python for Everybody Specialization,Software Development,3272,2660,81.2958435207824,Tanya Gould,Senior Software Engineer,27,20
EN1223,EMP273,COR1432,100,2022-08-29,1,"Conjunctions, Connectives, and Adverb Clauses",Learning English,736,639,86.82065217391305,Beverly Meza,Solution Consultant,21,14
EN1224,EMP007,COR1092,100,2022-08-30,1,Linux Server Management and Security,Security,446,307,68.83408071748879,Lauren Green,Solution Consultant,28,21
EN1225,EMP079,COR1798,23,2022-08-30,0,Computational Social Science Methods,Data Analysis,2610,1358,52.03065134099617,Roger Montgomery,Solution Enabler,17,10
EN1226,EMP043,COR0531,100,2022-08-30,1,Driving business towards the Sustainable Development Goals,Business Essentials,1677,1279,76.26714370900417,Bonnie Grant,Solution Consultant,24,17
EN1227,EMP225,COR0800,100,2022-08-30,1,Python and Statistics for Financial Analysis,Finance,3422,3270,95.55815312682641,Teresa Andrews MD,Senior Software Engineer,29,22
EN1228,EMP036,COR1111,100,2022-08-30,1,Developing Cloud Native Applications,Software Development,3559,2529,71.059286316381,Daniel Soto,Software Engineer,29,22
EN1229,EMP138,COR0663,69,2022-08-31,0,The Bits and Bytes of Computer Networking,Networking,1505,1321,87.77408637873754,Richard Blake,Senior Software Engineer,27,20
EN1230,EMP269,COR0639,100,2022-08-31,1,Building AI Powered Chatbots Without Programming,Design and Product,1182,819,69.28934010152284,Jillian Martinez,Solution Consultant,10,3
EN1231,EMP057,COR1414,100,2022-08-31,1,Drug Discovery,Healthcare Management,4643,3174,68.36097350850743,Leslie Davis,Solution Consultant,22,15
EN1232,EMP024,COR1268,100,2022-08-31,1,IoT Cloud,Mobile and Web Development,3666,2818,76.86852154937262,Justin Jackson,Solution Enabler,28,21
EN1233,EMP278,COR0995,100,2022-08-31,1,ChatGPT for Beginners: SciFi Writing with Dall-e,Algorithms,3564,3502,98.26038159371492,Meredith Clark,Solution Enabler,22,15
EN1234,EMP257,COR0014,55,2022-08-31,0,Python for Everybody Specialization,Software Development,3272,2660,81.2958435207824,Mikayla Wright MD,Solution Consultant,27,20
EN1235,EMP129,COR0848,100,2022-08-31,1,Dog Emotion and Cognition,Animal Health,941,643,68.33156216790648,Heather Green,Software Engineer,12,5
EN1236,EMP243,COR1418,20,2022-09-01,0,The Define Phase for the 6 σ Black Belt,Business Essentials,4637,4388,94.63014880310546,Sergio Taylor,Solution Enabler,16,9
EN1237,EMP006,COR1414,100,2022-09-01,1,Drug Discovery,Healthcare Management,4643,3174,68.36097350850743,Kimberly Patel,Solution Consultant,22,15
EN1238,EMP224,COR0405,100,2022-09-01,1,Strategic Thinking for Everyone Specialization,Personal Development,475,410,86.31578947368422,Zachary Schwartz,Software Engineer,18,11
EN1239,EMP248,COR0850,100,2022-09-01,1,Analyze Datasets and Train ML Models using AutoML,Machine Learning,1934,1604,82.93691830403309,Megan Doyle,Senior Software Engineer,29,22
EN1240,EMP169,COR1068,100,2022-09-01,1,Positive Psychology: Applications and Interventions,Psychology,1956,1008,51.533742331288344,James Johnson,Solution Enabler,23,16
EN1241,EMP133,COR1580,100,2022-09-01,1,Cybersecurity Capstone Project,Computer Security and Networks,4964,4687,94.41982272361,Robert Gould,Senior Software Engineer,27,20
EN1242,EMP260,COR1558,100,2022-09-01,1,Concept Art for Video Games,Music and Art,3061,2690,87.87977785037569,Victoria Moore,Solution Consultant,22,15
EN1243,EMP157,COR1334,86,2022-09-02,0,Wharton Business Foundations Capstone,Business Essentials,4863,3378,69.46329426280074,Douglas Neal,Solution Consultant,9,2
EN1244,EMP111,COR1994,100,2022-09-02,1,Value-Based Care: Managing Processes to Improve Outcomes,Patient Care,4814,0,0.0,Brandon Cantu,Solution Consultant,21,14
EN1245,EMP148,COR1521,100,2022-09-02,1,Quantitative Foundations for International Business,Business Essentials,1066,848,79.54971857410882,Daniel Thompson,Solution Enabler,14,7
EN1246,EMP190,COR0996,100,2022-09-03,1,Curso Completo de Power BI Desktop,Data Analysis,342,274,80.11695906432749,Rita George,Solution Enabler,25,18
EN1247,EMP131,COR1385,53,2022-09-03,0,Finding Mutations in DNA and Proteins (Bioinformatics VI),Health Informatics,3752,1889,50.346481876332625,Patricia Richards,Solution Consultant,7,0
EN1248,EMP014,COR0892,59,2022-09-04,0,Liabilities and Equity in Accounting,Business Essentials,276,160,57.971014492753625,William Jackson,Solution Enabler,2,0
